명소 이름,개요,주소,Latitude,Longitude,문의,주차장,화장실,추천코스,전체코스,추천계절,휴무일,관람료,보조기기 대여,편의/부대시설,해설사,추천 대상,이동약자를 위한 안내
산지천갤러리(산짓물공원),"녹수장, 금성장이라는 이름의 여관 건물을 재생하여 만든 문화공간인 산지천 갤러리와 산지천을 따라 조성된 산짓물공원으로 이루어진 산책로이다. 산지천 갤러리는 건물들에 대한 사람들의 관심과 애정 어린 목소리를 통해 전시공간으로 새롭게 재탄생되었으며, 산지천을 따라 산지교, 산짓물전망대, 산지천갤러리 등 제주의 현재와 과거를 함께 느낄 수 있는 다양한 문화예술 콘텐츠를 제공하는 곳이다. ",제주시 중앙로 3길 36,33.5151533,126.5283418,064- 725- 1208,"주차장 위치는 산짓물공영주차장을 이용하고, 주차료는 30분주차 무료, 15분 초과 5백원, 30분 초과 1천원, 1일 주차는 1만원이다.","장애인 화장실: 있음, 구분: 남여구분, 위치: 매표소 지나 왼쪽, 주변(대체)화장실:-/출입문 폭 84cm,  대변기 좌: 132cm, 우: 22cm",산짓물공원 공영주차장 → 산짓물공원  → 산지천갤러리  → 테우 (산지천 공연장)  →흑산호 가공소터 ( 산지교 앞)  → 산지천 전망대 (반환)  → 흑산호가공소터  → 산짓물공원  → 산짓물공원 공영주차장,,,"10:00~18:00 /  입장 마감 17:00,*휴무일 : 매주 월요일, 법정공휴일, 재단개원일(4.5.), 근로자의날(5.1.)",없음,없음,승강기:1,,,산짓물 공원에는 지하 공영주차장이 있다. 지하 주차장에서 승강기를 이용하면 바로 산짓물 공원이다. 산책코스는 공원에서 산지천갤러리( 목욕탕 굴뚝이 보이는 곳) 관람 후 산지천 따라 산책하는 코스다. 거의 모든 보행로가 평탄하게 마감되어 있어 휠체어 이용인도 이용에 어려움이 없다. 다만 공원에서 나오는 출구에 5도 내리막과 반환점인 전망대에 6도 오르막이 있어 주의가 필요하다.
서복전시관-정방폭포전망대,"1999년 2월 27일 문화관광부 전국 7대 문화관광권 개발사업으로 지정되어 2003년 9월 26일 개관하였으며, 전시관에는 서복상을 비롯한 진시황릉의 청동마차, 병마용 등 관련 자료들이 전시되어있다. 서복전시관은 실내전시관과 야외산책로가 있어서 계절과 날씨에 상관없이 관람이 가능한 관광지이나, 야외산책로는 꽃피는 봄과 공활한 가을에 아름다운 서귀포 바다 풍경과 맑은 하늘을 즐기기에 적당하다.  밖으로 펼쳐지는 아름다운 풍경에 나도 모르게 홀리어 넋을 잃게된다. 서복 서복은 서불이라고도 불리며, BC255(제왕 10)년 진나라가 통일하기 전 제나라에서 태어났다. 서복의 고향은 진나라 당시 제군 황현 서향으로 오늘날 산동성 용구시이다. 한편 강소성 감유현 서부촌도 서복의 고향이라 전해진다. 서복은 제나라에서 태어나 자연스레 연·제나라의 신선사상 영향을 받아 방사【方士:천문·의학·신선술·점복(占卜)·상술(相術) 등을 연구하는 사람】가 되었다. 서복은 진시황의 명을 받고 불로장생약을 찾아 3,000여 명의 대선단을 거느리고 동도하였으나, 평원광택 (평탄한 들과 넓은 진펄)을 얻게 되자 나라를 세우고 다시 돌아가지 않았다고 한다. 최종 정착지로 알려진 일본에서 서복은 농·어업· 의약·주거문화·토기 등 야요이문화를 창달시켜 일본 경제 사회의 발전을 촉진시켰다고 전해진다. 서복은 선진문명을 전파한 문화의 사자로서, 한국·중국·일본에서는 매년 서복을 기리는 행사를 개최하고 있다. 서복과 서귀포 서복은 영주산(한라산)에서 불로초(영지버섯,시로미, 금광초, 옥지지 등)를 구한 후 서귀포 앞바다 정방폭포 암벽에 서불과지(徐巿過之:서복이 이곳을 지나갔다)라는 글자를 새겨놓아 서귀포의 지명유래가 서쪽으로 돌아간 포구라고 전해진다. 조선 말 학자 김석익이 편찬한 파한록에는 1877(고종 14년) 제주 목사 백낙연이 서불과지 전설을 듣고 정방폭포 절벽에 긴 밧줄을 내려 글자를 탁본하였다. 글자는 12자인데 글자 획이 올챙이처럼 머리는 굵고 끝이 가는 중국의 고대문자인 과두문자여서 해독할 수가 없었다.는 기록이 있다.",제주특별자치도 서귀포시 칠십리로 156-8,33.2447048,126.5709423,064-760-6361,"서복전시관의 주차장은 40면이 있으며, 장애인주차구역은 3면이 있다.","장애인 화장실: 있음, 구분: -, 위치: 서복전시관 주차장 동쪽 야외, 주변(대체)화장실:-/출입문 폭 90cm, 정면 120cm, 좌 30cm, 우 29cm",주차장 시작 ~ 매표소 ~ 전시관 입구 ~ 전시관 ~  정원 ~ 야외산책로 ~ 계단앞 ~ 주차장 ~ 불로초공원 ~ 다리 ~ 주차장 끝,,,연중무휴 / 09:00 – 18:00,"개인  성인 500원 / 청소년, 군인 300원 / 경로, 6세이하, 장애인, 국가유공자 무료 / 제주도민 50%할인,단체 성인 400원 / 단체 청소년, 군인 200원","수동휠체어:1, 유아차:1",없음,,,"서복전시관은 매표소에 계단이 4칸 있고, 주출입구에 6cm 턱이 있으며, 야외 산책로의 노면은 넓은 판석, 좁은 장애물, 계단 등이 있으니 이 부분을 감안하여 관광하면 되겠다."
세계자동차-피아노박물관,"자동차를 테마로하는 대표적인 박물관으로 2008년 아시아 최초의 개인소장 자동차박물관으로 개관했다. 2019년 우리나라 최초의 개인소장 피아노박물관도 추가로 개관해서 함께 운영중이다. 박물관은 2층건물로 되어있으며 1층과 2층에 자동차전시관이 있으며 세계최초 휘발유 내연기관 자동차로 세계최초로 특허를받은 벤츠 패턴드 자동차를 비롯하여 전세계 단 6대밖에 없는 목재자동차인 힐만 스트레이트8 등 희귀하고 다양한 자동차들을 시대별로 만날볼수 있다. 피아노박물관은 2층에 있으며 세계적인 조각가 오귀스트 로댕이 조각한 전 세계 단 한 대뿐인 피아노와 24K 황금으로 100% 수제제작된  피아노가 있으며 베토벤,쇼팽,하이든 등의 음악가들의 피아노와 얽힌 특별한 스토리등을 담은 다양한 피아노 예술픔을 만날 수 있다. 실내에서 음악체험관과 오르골만들기 체험, 1층야외에서 체험할수 있는 어린이 교통체험장이 있고 박물관이지만 야외에 동백정원과 우리나라 국토 최남단 마라도를 볼 수 있는 전망대 그리고 사슴광장에서 꽃사슴 먹이주기 체험, 곶자왈 생태탐방 숲길등 다양한 콘텐츠들로 사계절 볼거리와 즐길거리를 주는 박물관이다.",제주특별자치도 서귀포시 안덕면 중산간서로 1610,33.283212,126.3499189,064-792-3000,"세계자동차&피아노 박물관 주차장은 매표소쪽 일반주차장에 소형차량 100대, 전기차 4대 ,대형버스 7대의 주차공간이 있고 장애인 전용주차구역은 매표소를 지나 박물관앞에 주차면수 5면으로 조성되어 있다.","장애인 화장실: 있음, 구분: 남여구분, 위치: 박물관 1층 영상관 옆, 주변(대체)화장실:-/출입문 폭 80cm, 대변기~출입문 - 90cm / 대변기~ 정면 – 138cm /     대변기~벽 좌 – 20cm 우 - 52cm",주차장  -> 매표소 -> 박물관입구 -> 박물관1층 로비 -> 1층 영상관 -> 1층 자동차 전시관 -> 2층 전시관 진입 (휠체어 이용인은 엘레베이터 이용)  -> 2층 자동차 전시관  -> 2층 피아노박물관 -> 2층 음악체험장(오르골 만들기 체험장) -> 2층 전시관에서 1층 자동차 전시관 이동 (휠체어 이용인은 엘레베이터 이용) ->1층 자동차 전시관 -> 1층 차량분해 전시룸 -> 1층 기념품샵  -> 1층 로비 -> 사슴광장 -> 주차장,,,연중무휴 / 09:00 – 18:00 (입장마감 17시),"개인 - 성인 13,000원/청소년 12,000원/어린이 12,000원/군인,경로,장애인 10,000원 단체 - 성인 11,000원/청소년 10,000원/어린이 10,000원/군인,경로,장애인 9,000원",수동휠체어:2,자동심실제세동기:1,,,"매표소 주차장에서 출발해서 박물관가는길 중간에 경사 5도 ~ 10도 오르막길이 35m정도있어 수동휠체어 이용인,유아차,노약자는 주의가 필요하다.,박물관앞에 5대 주차가능한 장애인전용주차구역이 있어 해당차량은 이용할수 있다."
세계자연유산센터,"대한민국 최초 세계자연유산으로서의 상징성 확보, 유일한 유네스코 세계 자연유산으로서의 가치를 널리 알리기 위해 조성되었다. 유네스코 제주 세계자연유산센터에서 화산활동을 통해 생성된 제주 용암동굴, 한라산의 다양한 식생, 용암동굴, 미래의 자연유산등 제주자연의 숨결을 느끼고 경험 해 볼 수 있다. 또한 제주의 성장 과정과 역사적 배경을 잘 이해 할 수 있고, 왜 자연유산으로 남을 수 있었는지 이해할 수 있는 전시관이다.",제주 제주시 조천읍 선교로 569-36,33.4569963,126.7143064,064-710-6657,"세계자연유산센터에는 3군데 있으나, 세계자연유산센터 근처 주차장에 장애인 주차구역 4대, 일반주차 면수 46대 주차 가능하다.","장애인 화장실: 있음, 구분: 남여구분, 위치: 4D 영상관 오른쪽, 주변(대체)화장실:-/출입문 폭 82cm/자동문","주차장1(이해를 돕기 위해 주차장에 번호를 붙여 표시함) → 매표소 → 세계자연유산센터 입구 → 로비홀 → 상설전시실(일반적인 입구로 입장했을시 두걸음 “화산이 낳은땅,제주”에서 세걸음 “한라산의 숨소리룸”으로 진행하는 통로가 계단으로 되어 있어 상설전시실 일반적인 출구부분으로 입장하여야 함  → VR체험존 → 미래 세계자연유산제주 → 제주 해양생태계 → 조화가 빚어낸 예술, 용암동굴(바닥부분은 용암이 흐르는 모양을 조형물 처리하여 바닥이 울퉁불퉁함- 휠체어 이용자 주의를 요함) → 신비의 땅 검은오름  → 한라산의 숨소리룸에서 되돌아 나온다. → 4D 영상관 → 기획전시실 → 전망대 → 로비홀 → 본관 뒤쪽 산책로를 따라 주차장으로.",,,"매  일 09:00 ~ 18:00,휴관일 : 매월 첫째 화요일, 설날, 추석","개인 - 성인 3,000원/청소년,군인 2,000원/어린이 2,000원 단체 - 성인 2,400원/청소년 1,600원/어린이 1,600원","수동휠체어:2, 유아차:3",자동심실제세동기:1 전동휠체어 급속충전기:1,,,"장애인주차장에서 세계자연유산센터까지 바닥마감, 단차 등 불편함은 없다."
수목원테마파크-LED공원,"수목원테마파크는 각양각색의 볼거리를 제공함과 동시에 직접 참여하고 추억을 만들어 갈 수 있는 관광서비스를 제공하고 있다. ‘도심안의 작은 휴식처’라는 슬로건에 부합할 수 있도록 아이스뮤지엄, 5D영상관. VR관. 초콜릿, 아이스크림 체험관. 티셔츠그리기 체험관등 다양한 콘텐츠가 있고, 제주도에서 가장 오래되고 규모가 큰 소나무군락지에 ‘수목원 야시장’을 조성하여 운영하고 있다. 공원 주변에는 일반식당과 같은 먹거리들과 LED의 화려한 조명을 바라보며 산책할 수 있는 LED공원이 조성되어 있다.",제주특별자치도 제주시 은수길 69,33.4705937,126.4883601,064-783-2008,"본관 앞부분 주차장1과 뒷부분에 주차장2가 있고, 장애인 주차구역은 주차장1에  6대 가능하고, 일반차량 73대, 대형버스 31대, 전기차 충전소가 2대 설치되어 있다 (주차장1에서 주출입구로 진입시 주차장출구 턱 5cm 이 있다)","장애인 화장실: 있음, 구분: 남여구분, 위치: 수목원테마파크 실내 1층 오른쪽, 주변(대체)화장실:-/출입문 폭 103cm/자동문","주차장1 – 수목원테마파크 본관 실내(아이스뮤지엄, 5D 영상관, 3D 착시아트, 체험관등) - 수목원길(LED공원) -주차장",,,아이스 뮤지엄 09:00 ~ 21:00 (입장마감 20:00) LED 공원 09:00 ~ 22:00,"일반 성인 15,000원/청소년 14,000원/소인 14,000원 (그 외 사이트 참고)","수동휠체어:3, 유아차:3","자동제세동기:1, 승강기1",,,"수목원테마파크는 주차장에서 본관으로 진입시 주차장나오는 부분에 턱 5cm가 있으며,,수목원길 돌하르방길 진입시 바닥은 코에네트로 되어 있으며 오르막 6m/10도로 되어 있다."
아르떼뮤지엄,"10개의 미디어아트 전시공간으로 살아있는 것 같은 움직임에 변화하는 영상이 새로운 예술의 향연을 맛 본다. 아르떼 뮤지엄의 돋보적인 예술미는 아티스트, 수학자. 건축가, 엔지니어의 관계에서 태어난 창작, 더 나아가 인간과 자연의 경계를 허무는 팀 랩(teamLab)전시이다. 계절의 무관하게 실내를 관람할 수 있다.",제주시 애월읍 어림비로 478,33.3964708,126.3446147,064-710-6714,장애인 전용주차구역이 있으며 매표소로 바로 갈 수 있는 입구 앞에 위치 해 있다. 매표소까지는 약23m 경사로가 설치되어 있고 시각장애인을 위한 주출입구 연결 유도표시 선형블록이 설치되어 있다. 장애인주차구역 2개진입로 바로 앞에 위치하여 있다.,"장애인 화장실: 있음, 구분: 남여구분, 위치: ‘WORMHOLE’ 옆 통로, 주변(대체)화장실:-/출입문 폭 105cm,대변기~정면 110cm,대변기~벽 우 30cm 좌 63cm",❶ 주차장 ~ ❷주출입문 ~ ❸매표소 ~ ❹ ‘Entrance’ 입간판. 플로워 미디어 아트 관람시작 ~ ❺워터 폴 미디어 아트 ~ ❻가든 미디어 아트 ~ ❼⓭나이트사파리&문 아트 ~ ❽웨이브 미디어 아트 ~ ❿웜홀 미디어 아트 ~ ⓫비치 미디어 아트 ~ ⓬정글 미디어 아트 ~ 티 바 ~ 출구 ~ 관람로 끝.,,,"10:00 – 20:00(입장마감 19:00), 연중무휴","성인 15,000, 청소년 12,000원, 어린이 10,000원","수동휠체어:2, 유아차:2",,,,"전체 편평한 실내 관람로로 되어있다. STAR 전시아트 공간에서만 유리바닥으로 안전상 출입이 제한된다.  ,휠체어 이용자 또한 관람로 따라 관람이 편하다.,시각장애인을 위한 시각안내표시 점자블록은 주차장에서부터 주출입구까지 만 있으며 연속적 유도표시 선형블록과 출입문 앞 점형블록이 있다."
용수포구,제주특별자치도 제주시 한경면 용수리에 있는 어촌정주어항으로 전형적인 어촌마을의 소규모 어항으로 20척 미만의 어선이 정박하는 항구이다. 용수리포구 또는 용수포구로 더 많이 알려져 있으며 특히 일몰시 포구를 따라 차귀도와 와도(누운섬)의 풍광이 매우 아름다워 관광객들에게 많은 사랑을 받고 있다.,제주특별자치도 제주시 한경면 용수1길,33.3222155,126.1727875,,용수포구에는 주차구역 표시가 되어 있는 주차장과 장애인 주차구역은 없으나 공터가 있어 주차장으로 이용 중이다.,"장애인 화장실: 있음, 구분: 남여구분, 위치: 성김대건표착기념관 뒤편, 주변(대체)화장실:-/출입문 폭 80cm/미닫이","용수포구 공터 주차장에서 출발 – 차귀도방향으로 진행(와도, 차귀도조망) – 용수마을 방사탑 2호 – 정자가 있는 쉼터(반환) – 용수포구 – 차귀도 요트사무실 – 용수포구 등대(반환) – 용수포구 공터 주차장",,,연중무휴,없음,없음,없음,,,"용수포구 산책로는 바닥 면이 포장도로로 되어 있고, 높낮이가 평탄해서 보장구 이용자의 이동시 접근성이 좋다. 하지만 등대로 진입 시 내리막 9도/12m, 중간에 패임 구간이 있다. 바람이 심한 날에는 파도가 등대 가는 길을 방해할 수 있으니 또한 주의가 필요하다."
점보빌리지,점보빌리지 공연장은 건물건축 당시부터 휠체어 접근성을 고려하여 만들어진 곳으로 동남아 현지에서 볼수 있었던 코끼리를 주제로한 공연장이다. 동남아 현지조련사가 직접 공연에 출연하여 다양한 공연을 보여주며 관객이 직접참여하는 공연도 준비되어있다. 공연 후 전통의상을 차려입은 현지조련사와 코끼리를 배경으로 기념촬영을 할수 있는 포토타임등 다양한 이밴트가 있다.실내공연인 코끼리 테마쇼는 천여석의 좌석으로사계절 날씨 영향없이 공연을 볼수 있다는 장점이 있으며 휠체어 접근성이 좋고 휠체어 전용 관람석도 12석을 갖추고 있어 관람이 편리하다.,제주특별자치도 서귀포시 안덕면 평화로 319번길 31-11,33.27601,126.3050559,064-792-1233,장애인전용주차구역 4대,"장애인 화장실: 있음, 구분: 남여구분, 위치: 공연장건물내 왼쪽, 주변(대체)화장실:-/출입문 폭 85cm, 대변기~출입문 - 230cm / 대변기~ 정면 – 85cm /     대변기~벽 좌 – 23cm 우 - 91cm",주차장  -> 매표소 -> 공연장,,,"코끼리 테마쇼,연중무휴 /,하절기(4월1일 ~ 10월31일)  10시30분,13시30분,15시,16시50분 4회공연,동절기(11월1일 ~ 3월31일)  10시30분,13시30분,16시30분,3회공연,코끼리 트래킹 체험,연중무휴 / 매일 09시30분 ~ 17시30분 수시운영","코끼리 테마쇼 - 대인 15,000원/청소년 12,000원/소인 10,000원 코끼리 트래킹 체험 - 18,000원",,자동심실제세동기:1,,,"주차장에서 공연장 건물 진입시 휠체어 이용인은 건물 좌,우측 경사로 이용"
제주국제평화센터,"2005년 정부에서 제주도를 <세계평화의 섬>으로 지정하고 평화에 대한 홍보, 전시교육, 체험 등을 수행하기 위해 조성한 랜드마크 시설이다. 세계평화의 섬 이미지 구현의 구심적 역할을 수행하며, 세계의 많은 국가 정상들이 모여 평화와 상생을 교류하는 곳이다. 특히 동북아시아 중심지로서의 역할을 하는 곳이다. 제주는 천혜의 자연환경과 섬 문화를 소유한 세계적인 평화의 섬이며, 보물섬이다. 제주국제평화센터에서 미래로 도약하는 세계평화중심지의 위상을 느낄 수 있는 공간에서 소중한 시간을 가질 수 있는 공간이다. 제주국제평화센터 건물 외관은 수려하고 주 출입구에 야자수 나무가 즐비해 있어서 여행자의 마음을 설레게 한다. 제주여행 중 비가 오면 꼭 찾는 관광지며, 특히 관광약자 접근성이 좋다. 휠체어. 유아차, 엘리베이터 등 편의시설도 잘 설치되어 있다.",제주특별자치도 서귀포시 중문관광로 227-24 (중문관광단지 내) (우) 63546,33.2486522,126.4124374,064-735-6550,"장애인주차구역과 임산부 주차구역이 있으며, 전기차 충전기는 2대 충전 할 수 있도록 설치되어 있다. 바닥면은 구멍 큰 블록보드으로 되어 있다.","장애인 화장실: 있음, 구분: 남여구분, 위치: 1층 매표소 맞은편, 주변(대체)화장실:-/출입문 폭 79cm,  대변기 좌: 35cm , 우: 91cm, 대변기~ 정면 : 140cm",주차장 → 매표소 → 기획전기관 → 제1전시실 → 제2전시실 → 엘리베이터 이용 지하로 이동 →베릿내 문화 복합공간 → 제3전시실  →베릿내 문화복합공간 → 승강기 이용 1층으로 이동 → 야외전시실 → 주차장,주차장→ 매표소 → 기획전시실 → 제1전시실 → 제2전시실 → 계단을 이용하여 지하로 이동 →제3전시실 →베릿내 문화 복합공간 →  양쪽 계단 or 승강기를 이용하여 1층 이동 → 야외전시실 → 주차장,,"고정 휴무/ 매월 둘째, 넷째 월요일,            휴무일/ 1월 1일, 설날 및 추석 전. 당일","성인(20~64세)1,500원,           성인(20~64세) 단체(10인 이상)1,000원,           청소년(8~19세), 군인(하사 이하)1,000원,           청소년(8~19세), 군인(하사 이하) 단체(10인 이상)500원,           *무료 : 국가유공자, 장애인, 제주도민, 재외제주도민","수동휠체어:2, 유아차:4","자동심실제세동:1, 전동휠체어 급속 충전기:1",,,"제주국제평화센터는 대체로 관광약자에게 접근성이 좋은 관광지다. 보조기기 이용인은 1층 관람 후, 다음 제3 전시관으로 이동 시 매표소 앞에 있는 양문형 승강기를 이용하여 갈 수 있다."
제주아리랑공연장,"아리랑공연 혼은 2018년 평창동계올림픽 정식 초청작품으로 공연할만큼 뛰어난 예술미를 자랑하며 한국무용,두드림공연,태권뮤지컬이 결합된 작품으로 다양한 한국적인 문화요소를 융합해서 전통적이고 독특한 문화공연을 보여준다.전체 930석의 실내공연장으로 계절과 날씨에 관계없이 사계절 관람이 가능하다.",제주특별자치도 서귀포시 표선면 번영로2564-21,33.4029137,126.7789058,064-787-2258,장애인전용주차구역 4대,"장애인 화장실: 있음, 구분: 남여구분, 위치: 공연장 외부 왼쪽, 주변(대체)화장실:-/출입문 폭 84cm, 대변기~출입문 - 145cm / 대변기~ 정면 – 33cm /     대변기~벽 좌 – 26cm 우 - 95cm",주차장  -> 매표소 -> 공연장,,,"아리랑 공연 혼,연중무휴 / 매일 09시40분,11시,14시30분 3회공연,낙타 트래킹 체험,연중무휴 / 매일 09시 ~ 17시30분 수시운영","아리랑공연 혼 - 성인 20,000원/청소년 18,000원/소인 15,000원 낙타 트래킹 체험 - 15,000원",없음,없음,,,공연장입장시 계단이 있어 휠체어 이용인은 경사로를 이용 입장해야한다. 길이 5m 오르막경사 13도의 짧은구간 이지만 보조기기 이용인은 동행인의 도움이 필요할수 있다. 휠체어 전용 관람석은 없다.
제주자연생태공원,"편백나무, 삼나무, 상수리나무류 등이 우거진 숲. 편안히 산책할 수 있는 궁대오름을 기반으로 조성한 생태공원에서 보기 쉽지 않은 독수리가 있는 맹금류 관찰장, 노루가 뛰고 노는 관찰장, 우리나라에서 멸종위기의 보호 받는 반달가슴곰 등 보호하고 사육하는 모습을 관찰할 수 있다. 더불어 이 곳 지대에서 바로 보는 성산일출봉, 우도, 그리고 오름들은 멋진 장관을 이룬다. 아무래도 날씨에 따라 방문 주의가 필요하겠지만 오름의 억새를 보고자 한다면 가을에, 넓은 공원의 메밀밭과 유채꽃밭을 보고자 한다면 봄에 방문도 좋다. ",서귀포시 성산읍 금백조로 446,33.4401361,126.8237773,064-787-4711,생태공원 내의 무료 주차장 있으며 장애인주차구역 없으나 넓게 조성되어 있다. 전기충전기가 설치되어 있다.,"장애인 화장실: 있음, 구분: 남여구분, 위치: 해설대기소 건물, 주출입구 진입 전, 주변(대체)화장실:-/출입문 폭 83cm / 대변기~출입문 105cm / 대변기~우측 공간 27cm 좌 측공간 18cm","❶주차장 ~ ❷해설대기소 ~ ❸주출입구  ~ ❹맹금류 관찰장 ~ ❻온실 ~ ❼ 노루 관찰장 ~ ❽전망대 ~ ❾메밀밭•유채꽃밭 ~ 회귀 반환하여 관람 종료, ",,,"10:00 ~ 17:00,(연중무휴 / 입장마감 : 동절기 오후4시, 하절기 오후4시30분)",없음,없음,없음,,,오름 주변 공원이지만 접근성이 좋은 편이라 전망대까지 일부 오르막 경사구간을 제 한다면 비교적 관람이 수월하다. 노면 상태가 편평하게 소소한 턱 없이 조성이 잘 되어 있다.
